{
  "schema": "travelomore/destination_city/1.0.0",
  "parent": "country:AE",
  "notes": "All index_0_100 fields are Travelomore editorial indices calibrated on the SAME fixed rubric as every other country catalog (see docs/normalization_rules.md §4) — that shared rubric is what makes a persona mean the same thing in Bangkok and in Dubai. Physical measures (km, hours, °C, ₹, µg/m³) are observed or market-sampled. Every city inherits unspecified signals from country:AE. Note the emirate-level alcohol split: it is real, legally grounded data (Sharjah is dry), not an editorial preference — it is exactly the kind of fact that must live here rather than in engine logic.",
  "entities": [
    {
      "id": "city:AE:DXB",
      "type": "destination_city",
      "name": "Dubai",
      "parent_id": "country:AE",
      "province": "Dubai",
      "coordinates": {
        "lat": 25.2048,
        "lng": 55.2708
      },
      "gateway_airport": ["DXB", "DWC"],
      "summary": "The country's gateway and its most complete city: the world's tallest building, mall-scale shopping treated as a genuine attraction, a desert an hour from the skyline, calm Gulf beaches, the region's best metro, and a licensed nightlife scene — all built for first-timers and priced accordingly.",
      "best_months": [11, 12, 1, 2, 3],
      "tags": ["city_break", "nightlife", "shopping", "food", "beginner_friendly", "package_ready", "walkable", "family_friendly", "luxury", "beach", "desert"],
      "attributes": {
        "safety_index_0_100": 92,
        "female_solo_safety_index_0_100": 88,
        "night_safety_index_0_100": 92,
        "scam_incidence_index_0_100": 22,
        "street_harassment_index_0_100": 12,
        "water_safety_index_0_100": 82,
        "road_fatality_per_100k": 7,
        "emergency_response_index_0_100": 92,
        "intl_hospital_quality_index_0_100": 92,
        "nearest_intl_hospital_km": 2,
        "pharmacy_density_index_0_100": 95,
        "medevac_ease_index_0_100": 95,
        "dengue_malaria_risk_index_0_100": 5,
        "zika_risk_level": "none",
        "food_hygiene_index_0_100": 90,
        "tap_water_potable": "filtered_only",
        "pm25_annual_ug_m3": 40,
        "pediatric_care_index_0_100": 90,
        "obstetric_care_index_0_100": 90,
        "wheelchair_infrastructure_index_0_100": 88,
        "step_free_ratio_0_1": 0.85,
        "elevator_availability_index_0_100": 92,
        "accessible_transport_index_0_100": 85,
        "accessible_toilet_index_0_100": 85,
        "public_toilet_index_0_100": 82,
        "typical_walking_km_per_day": 4.5,
        "terrain_type": "flat",
        "exertion_level_1_5": 2,
        "max_altitude_m": 10,
        "rest_stop_index_0_100": 85,
        "shade_seating_index_0_100": 70,
        "stroller_friendly_index_0_100": 90,
        "peak_heat_index_c": 45,
        "weather_comfort_index_0_100": 50,
        "crowd_index_0_100": 78,
        "noise_index_0_100": 72,
        "direct_flights_from_india_weekly": 300,
        "avg_flight_hours_from_india": 3.2,
        "transfer_time_from_gateway_hours": 0.4,
        "intracity_transport_index_0_100": 85,
        "transport_comfort_index_0_100": 90,
        "motion_sickness_risk_index_0_100": 12,
        "self_drive_index_0_100": 80,
        "road_quality_index_0_100": 96,
        "scenic_drive_index_0_100": 45,
        "fuel_stop_index_0_100": 95,
        "parking_index_0_100": 65,
        "avg_daily_cost_per_pax_inr": 10500,
        "value_index_0_100": 58,
        "group_value_index_0_100": 55,
        "beer_500ml_price_inr": 950,
        "nightlife_venue_index_0_100": 88,
        "party_scene_index_0_100": 82,
        "alcohol_access_index_0_100": 70,
        "late_night_food_index_0_100": 88,
        "group_activity_index_0_100": 85,
        "adult_entertainment_index_0_100": 55,
        "wellness_spa_index_0_100": 88,
        "beach_club_index_0_100": 90,
        "kid_activity_index_0_100": 95,
        "infant_amenity_index_0_100": 88,
        "kids_dining_index_0_100": 90,
        "calm_beach_index_0_100": 78,
        "family_room_index_0_100": 88,
        "english_index_0_100": 95,
        "tourist_infra_index_0_100": 98,
        "tourist_police_index_0_100": 90,
        "card_upi_acceptance_index_0_100": 92,
        "veg_food_index_0_100": 92,
        "indian_food_index_0_100": 98,
        "photogenic_index_0_100": 92,
        "iconic_landmark_index_0_100": 95,
        "content_saturation_index_0_100": 90,
        "drone_policy": "banned",
        "avg_wifi_mbps": 130,
        "coworking_index_0_100": 88,
        "golden_hour_index_0_100": 80
      },
      "meta": {
        "data_confidence": 0.8,
        "last_verified": "2026-07-16",
        "review_status": "editorial_draft"
      }
    },
    {
      "id": "city:AE:AUH",
      "type": "destination_city",
      "name": "Abu Dhabi",
      "parent_id": "country:AE",
      "province": "Abu Dhabi",
      "coordinates": {
        "lat": 24.4539,
        "lng": 54.3773
      },
      "gateway_airport": ["AUH"],
      "summary": "The capital, and the culture-and-family counterweight to Dubai: the Grand Mosque and the Louvre carry genuine gravity, Yas Island holds the region's best theme parks, and the Corniche is a calm, walkable, shallow-water waterfront. Quieter, cheaper and slower than Dubai, with weaker public transport.",
      "best_months": [11, 12, 1, 2, 3],
      "tags": ["city_break", "heritage", "cultural", "family_friendly", "beach", "luxury", "package_ready", "beginner_friendly", "walkable"],
      "attributes": {
        "safety_index_0_100": 93,
        "female_solo_safety_index_0_100": 90,
        "night_safety_index_0_100": 93,
        "scam_incidence_index_0_100": 18,
        "street_harassment_index_0_100": 10,
        "water_safety_index_0_100": 84,
        "road_fatality_per_100k": 7.5,
        "emergency_response_index_0_100": 90,
        "intl_hospital_quality_index_0_100": 90,
        "nearest_intl_hospital_km": 3,
        "pharmacy_density_index_0_100": 90,
        "medevac_ease_index_0_100": 90,
        "dengue_malaria_risk_index_0_100": 5,
        "zika_risk_level": "none",
        "food_hygiene_index_0_100": 90,
        "tap_water_potable": "filtered_only",
        "pm25_annual_ug_m3": 42,
        "pediatric_care_index_0_100": 88,
        "obstetric_care_index_0_100": 88,
        "wheelchair_infrastructure_index_0_100": 88,
        "step_free_ratio_0_1": 0.85,
        "elevator_availability_index_0_100": 90,
        "accessible_transport_index_0_100": 78,
        "accessible_toilet_index_0_100": 85,
        "public_toilet_index_0_100": 80,
        "typical_walking_km_per_day": 4,
        "terrain_type": "flat",
        "exertion_level_1_5": 2,
        "max_altitude_m": 8,
        "rest_stop_index_0_100": 85,
        "shade_seating_index_0_100": 68,
        "stroller_friendly_index_0_100": 88,
        "peak_heat_index_c": 45,
        "weather_comfort_index_0_100": 48,
        "crowd_index_0_100": 55,
        "noise_index_0_100": 55,
        "direct_flights_from_india_weekly": 90,
        "avg_flight_hours_from_india": 3.4,
        "transfer_time_from_gateway_hours": 0.5,
        "intracity_transport_index_0_100": 62,
        "transport_comfort_index_0_100": 85,
        "motion_sickness_risk_index_0_100": 12,
        "self_drive_index_0_100": 82,
        "road_quality_index_0_100": 96,
        "scenic_drive_index_0_100": 55,
        "fuel_stop_index_0_100": 92,
        "parking_index_0_100": 78,
        "avg_daily_cost_per_pax_inr": 9000,
        "value_index_0_100": 62,
        "group_value_index_0_100": 60,
        "beer_500ml_price_inr": 900,
        "nightlife_venue_index_0_100": 62,
        "party_scene_index_0_100": 55,
        "alcohol_access_index_0_100": 65,
        "late_night_food_index_0_100": 75,
        "group_activity_index_0_100": 72,
        "adult_entertainment_index_0_100": 35,
        "wellness_spa_index_0_100": 85,
        "beach_club_index_0_100": 75,
        "kid_activity_index_0_100": 92,
        "infant_amenity_index_0_100": 85,
        "kids_dining_index_0_100": 88,
        "calm_beach_index_0_100": 88,
        "family_room_index_0_100": 88,
        "english_index_0_100": 92,
        "tourist_infra_index_0_100": 92,
        "tourist_police_index_0_100": 88,
        "card_upi_acceptance_index_0_100": 90,
        "veg_food_index_0_100": 90,
        "indian_food_index_0_100": 96,
        "photogenic_index_0_100": 90,
        "iconic_landmark_index_0_100": 88,
        "content_saturation_index_0_100": 72,
        "drone_policy": "banned",
        "avg_wifi_mbps": 120,
        "coworking_index_0_100": 72,
        "golden_hour_index_0_100": 82
      },
      "meta": {
        "data_confidence": 0.78,
        "last_verified": "2026-07-16",
        "review_status": "editorial_draft"
      }
    },
    {
      "id": "city:AE:SHJ",
      "type": "destination_city",
      "name": "Sharjah",
      "parent_id": "country:AE",
      "province": "Sharjah",
      "coordinates": {
        "lat": 25.3463,
        "lng": 55.4209
      },
      "gateway_airport": ["SHJ"],
      "summary": "The UAE's cultural capital and its most conservative emirate: restored heritage quarters, the region's strongest Islamic-art museum, and a souk culture that Dubai has largely replaced with malls. Alcohol is illegal emirate-wide and nightlife effectively does not exist — which makes it the cheapest, quietest and most culturally intact base in the country, and the wrong one for a party trip.",
      "best_months": [11, 12, 1, 2, 3],
      "tags": ["heritage", "cultural", "food", "value", "family_friendly", "walkable"],
      "attributes": {
        "safety_index_0_100": 92,
        "female_solo_safety_index_0_100": 88,
        "night_safety_index_0_100": 90,
        "scam_incidence_index_0_100": 22,
        "street_harassment_index_0_100": 14,
        "water_safety_index_0_100": 78,
        "road_fatality_per_100k": 8,